title,company,empn_rate,posted_time,location,salary,preview,link,job_key,empn_id,job_type
Data Scientist/ Statistican Intern (PhD Level),Lubrizol Corporation,3.9,30+ days ago,"Wickliffe, OH 44092",NA,"Enrolled in PhD program such as statistics, data analytics, machine learning.Create predictive models by mining complex data for critical formulating or…",http://www.indeed.com/rc/clk?jk=ad9e440d983349fc&fccid=a6ecb44bea23e5cd&vjs=3,ad9e440d983349fc,NA,internship
ML/Data Science Intern (Summer 2020),Splunk,4.1,30+ days ago,"San Francisco, CA",NA,"Strong interest in state-of-art Machine Learning techniques.Hands-on experience in Machine Learning techniques, such as logistic regression, naïve Bayes, SVM,…",http://www.indeed.com/rc/clk?jk=9042480af958a610&fccid=aef928e89977f7f0&vjs=3,9042480af958a610,NA,internship
Beyonders 2020 Summer Program - Data Science,Beyond Limits,3.6,30+ days ago,"Glendale, CA",NA,"Data science, artificial intelligence, cognitive computing, machine learning, Knowledge engineering, or natural language processing.",http://www.indeed.com/rc/clk?jk=f664f8b4fe53f808&fccid=46b1aa6b464bae94&vjs=3,f664f8b4fe53f808,NA,internship
Intern- Global Quality (GQ) Data Science,Micron,3.8,30+ days ago,"Boise, ID",NA,"Signal processing, image analytics, probability models, machine learning, statistical learning, computer programming, data engineering, pattern recognition and…",http://www.indeed.com/rc/clk?jk=eb8da20d8a130fd4&fccid=be240c643a8631c5&vjs=3,eb8da20d8a130fd4,NA,internship
Applied Data Science Internship,Civis Analytics,2.8,30+ days ago,"Chicago, IL",NA,Civis Analytics is looking for Applied Data Science interns to join our ADS practice in Chicago or DC and help us solve some of the most challenging and…,http://www.indeed.com/rc/clk?jk=6182ba98969179a7&fccid=85806092f576a90e&vjs=3,6182ba98969179a7,NA,internship
"Software Engineer Intern, Machine Learning (PhD)",Facebook,4.2,30+ days ago,"New York, NY 10017 (Midtown area)",NA,"Experience building systems based on machine learning and/or deep learning methods.Machine Learning, Computer Vision, AR/VR, Speech Recognition, Natural…",http://www.indeed.com/rc/clk?jk=1d2e56a586ed6473&fccid=1639254ea84748b5&vjs=3,1d2e56a586ed6473,NA,internship
Machine Learning Application Intern- Audio Analytics,Bosch Group,4.1,30+ days ago,"Pittsburgh, PA 15222 (Strip District area)",NA,Our team is developing novel signal processing and machine learning algorithms for analyzing the audio patterns generated by various physical processes around…,http://www.indeed.com/rc/clk?jk=55aea54ed85f3132&fccid=a2faf1301ac6ad4b&vjs=3,55aea54ed85f3132,NA,internship
"Research Intern, Applied Research - Core Machine Learning",Facebook,4.2,30+ days ago,"New York, NY 10017 (Midtown area)",NA,"Experience building systems based on machine learning, reinforcement learning and/or deep learning methods.Contribute research that can be applied to Facebook…",http://www.indeed.com/rc/clk?jk=08a9d27919784d96&fccid=1639254ea84748b5&vjs=3,08a9d27919784d96,NA,internship
Machine Learning Engineer Intern,UnifyID,NA,30+ days ago,"Redwood City, CA",NA,"UnifyID has created the next generation of user authentication that combines behavioral biometrics from smartphones, machine learning modeling, and enterprise…",http://www.indeed.com/rc/clk?jk=097e72760e26dc06&fccid=3474bed27ac89b0a&vjs=3,097e72760e26dc06,NA,internship
"2020 Intern - Junior Data Scientist Intern, Chief Analytics...",IBM,3.9,30+ days ago,"Armonk, NY 10504",NA,"Experience with Python, R, SQL, or another programming language.Familiarity with machine learning and/or natural language processing.",http://www.indeed.com/rc/clk?jk=3bfc1581188b5b6f&fccid=de71a49b535e21cb&vjs=3,3bfc1581188b5b6f,NA,internship
"2020 Intern - Data Scientist Intern, Chief Analytics Office",IBM,3.9,30+ days ago,"Armonk, NY 10504",NA,"You will work alongside consultants, managers, and data scientists to enhance business performance through analytics and data science focused initiatives.",http://www.indeed.com/rc/clk?jk=42dca4aa43f6f45c&fccid=de71a49b535e21cb&vjs=3,42dca4aa43f6f45c,NA,internship
Data Scientist Intern,Sony Interactive Entertainment PlayStation,3.8,30+ days ago,"San Diego, CA",NA,A deep understanding of data concepts.Support WWS QA Business Analyst with Project Analysis.Interest in data visualization to tell a story.,http://www.indeed.com/rc/clk?jk=2586022bd1e58e4e&fccid=750bb2e27e97e3c1&vjs=3,2586022bd1e58e4e,NA,internship
Data Science Internship (Undergraduate),CVS Health,3.4,30+ days ago,"New York, NY",NA,"We use advanced analytics tools, modeling and machine learning to generate insights by leveraging data within a cutting-edge petabyte-scale Hadoop environment.",http://www.indeed.com/rc/clk?jk=6a131e138284902b&fccid=be3b11aa573faee7&vjs=3,6a131e138284902b,NA,internship
Data Science Internship (Graduate),CVS Health,3.4,30+ days ago,"New York, NY",NA,"We use advanced analytics tools, modeling and machine learning to generate insights by leveraging data within a cutting-edge petabyte-scale Hadoop environment.",http://www.indeed.com/rc/clk?jk=2a6006b3b87f1fc7&fccid=be3b11aa573faee7&vjs=3,2a6006b3b87f1fc7,NA,internship
"2020 Intern - Data Scientist Intern, Chief Analytics Office",IBM,3.9,30+ days ago,"Armonk, NY 10504",NA,"You will work alongside consultants, managers, and data scientists to enhance business performance through analytics and data science focused initiatives.",http://www.indeed.com/rc/clk?jk=42dca4aa43f6f45c&fccid=de71a49b535e21cb&vjs=3,42dca4aa43f6f45c,NA,internship
2020 Summer Intern - Data Scientist/Data Analytics (.com Cal...,Walmart,3.5,30+ days ago,"Sunnyvale, CA 94086",NA,"In past years, interns have had the opportunity to work on projects involving researching new trends in the industry and utilizing up-to-date technology (for…",http://www.indeed.com/rc/clk?jk=d4b48834f7f76ae0&fccid=822bc5d9a49270ea&vjs=3,d4b48834f7f76ae0,NA,internship
Intern - Data Scientist (Summer 2020),Micron,3.8,30+ days ago,"Boise, ID",NA,"Pursuing a MS/PhD Degree in Computer Science, Data Science, Machine Learning, or related field.Machine learning and other advanced analytical methods.",http://www.indeed.com/rc/clk?jk=73f4ee9a0cea4352&fccid=be240c643a8631c5&vjs=3,73f4ee9a0cea4352,NA,internship
Data Science Intern,Shure Incorporated,4.1,30+ days ago,"Niles, IL 60714",NA,"Knowledge of machine learning and deep learning models and frameworks.As a Data Science Intern, you will work with a team of engineers who research, prototype,…",http://www.indeed.com/rc/clk?jk=fbb342f8d0fe010f&fccid=ea62f859f853d3ba&vjs=3,fbb342f8d0fe010f,NA,internship
IT Data Science Intern,Shure Incorporated,4.1,30+ days ago,"Skokie, IL",NA,"Some experience with open-source programing languages, e.g. Python, R, etc.Assist with analytics to uncover potential opportunities.",http://www.indeed.com/rc/clk?jk=d28ee584c43c5a17&fccid=ea62f859f853d3ba&vjs=3,d28ee584c43c5a17,NA,internship
PhD Data Science Intern,HP,4.0,30+ days ago,"San Diego, CA",NA,"Collaborates with peers, junior engineers, data scientists and project team.Experience building and interpreting advanced machine learning models on real…",http://www.indeed.com/rc/clk?jk=4334d4f7380f1be3&fccid=1b866506aec22461&vjs=3,4334d4f7380f1be3,NA,internship
DSP Data Science Intern,Shure Incorporated,4.1,30+ days ago,"Niles, IL 60714",NA,Each intern will receive a competitive salary and students who reside out of Illinois will receive a housing stipend to cover living expenses.,http://www.indeed.com/rc/clk?jk=6fc4d575716697fd&fccid=ea62f859f853d3ba&vjs=3,6fc4d575716697fd,NA,internship
Intern - Machine learning based LMP consistency monitor,ISO New England Inc.,NA,30+ days ago,"Holyoke, MA 01040",NA,Machine Learning Based LMP Consistency Monitor.Candidates are expected to develop machine learning/data analysis models to identify possible LMP inconsistency…,http://www.indeed.com/rc/clk?jk=7c311f56defd43c5&fccid=7bf787d799ccda31&vjs=3,7c311f56defd43c5,NA,internship
Graduate Intern - Summer 2020 - NLP / Speech / Machine Learn...,Raytheon,4.0,30+ days ago,"Cambridge, MA",NA,Familiarity with state-of-the-art machine learning techniques and programming packages.Opportunities to propose new ideas and solutions to challenging…,http://www.indeed.com/rc/clk?jk=768f192c79720a51&fccid=aa53b551f9df0210&vjs=3,768f192c79720a51,NA,internship
Undergraduate Intern - Summer 2020 - NLP / Speech / Machine...,Raytheon,4.0,30+ days ago,"Cambridge, MA",NA,Familiarity with state-of-the-art machine learning techniques and programming packages.Opportunities to propose new ideas and solutions to challenging…,http://www.indeed.com/rc/clk?jk=d93b65d56a85c283&fccid=aa53b551f9df0210&vjs=3,d93b65d56a85c283,NA,internship
Data Scientist Intern,ViaSat,3.8,30+ days ago,"Carlsbad, CA 92009",NA,Use educational background in data science and perform data mining analysis.Strong Python and/or SQL skills.Experience with XML or SQL.,http://www.indeed.com/rc/clk?jk=06c14e1ea1b762c8&fccid=8b219f1987ef65ea&vjs=3,06c14e1ea1b762c8,NA,internship
Grad Intern Data Scientist (Summer 2020),The Hershey Company,3.9,30+ days ago,"Hershey, PA",NA,"+1 years of relevant experience building machine learning or deep learning models and/or systems.As part of a team, use machine learning, deep learning and…",http://www.indeed.com/rc/clk?jk=317ac0432debc76d&fccid=e08898c7a89673c9&vjs=3,317ac0432debc76d,NA,internship
Data Scientist Intern,Continental Western Group,3.2,30+ days ago,"Urbandale, IA 50322",NA,"Helps shape the overall advanced analytics strategy for the organization.Identifies, retrieves, and prepares data in support of actuarial analysis through R,…",http://www.indeed.com/rc/clk?jk=feb4b5bb5edfd9b8&fccid=ee3cadd4c28d3451&vjs=3,feb4b5bb5edfd9b8,NA,internship
Machine Learning Research Intern,Scaleapi,NA,30+ days ago,"San Francisco, CA",NA,"Currently enrolled in a PhD Program with a focus on Machine Learning, Deep Learning, Computer Vision or Natural Language Processing.",http://www.indeed.com/rc/clk?jk=3e36903156c353fb&fccid=55ebd28e88790c63&vjs=3,3e36903156c353fb,NA,internship
Data Science Intern - Global Technology,Goodyear,3.7,30+ days ago,"Akron, OH",NA,"Must have experience coding with R, Python or SQL.A separate profile must be created for each position applied.",http://www.indeed.com/rc/clk?jk=10d909e1443e8c27&fccid=e451672f561ffb08&vjs=3,10d909e1443e8c27,NA,internship
Intern - HR Data Science,Micron,3.8,30+ days ago,"Boise, ID",NA,"Deep understanding of common data science concepts, including machine learning or deep learning techniques (e.g., K-NN, naïve Bayes, SVM, decision trees, neural…",http://www.indeed.com/rc/clk?jk=2c1a491add17b7ca&fccid=be240c643a8631c5&vjs=3,2c1a491add17b7ca,NA,internship
Machine Learning Researcher,Marinus Analytics,NA,30+ days ago,"Pittsburgh, PA",NA,"Experience (classroom or work related) in one or more areas of computer science, such as Natural Language Understanding, Neural Networks, Computer Vision,…",http://www.indeed.com/company/Marinus-Analytics/jobs/Machine-Learning-Researcher-a328010ebf0093b9?fccid=92de48b4df38c237&vjs=3,a328010ebf0093b9,NA,internship
Data Science Intern (Summer 2020),Wolverine Trading,4.2,30+ days ago,"Chicago, IL 60604 (Loop area)",NA,"Strong background in classical statistics and machine learning preferred.Data Scientists work with traders and engineers to develop, test, and implement…",http://www.indeed.com/rc/clk?jk=220e4a0c76ce08c6&fccid=1ec8c83c883d1273&vjs=3,220e4a0c76ce08c6,NA,internship
Intern- Data Science,Micron,3.8,30+ days ago,"Manassas, VA",NA,"Some experience with Machine Learning and/or Deep Learning.Our solutions are purpose built to use the value of data to unlock financial insights, accelerate…",http://www.indeed.com/rc/clk?jk=298cf3c98fb74d1d&fccid=be240c643a8631c5&vjs=3,298cf3c98fb74d1d,NA,internship
Data Scientist,Quaxigma,NA,30+ days ago,"Schaumburg, IL",NA,"Lead efforts in advanced analytics solutions to produce value corporate’s unstructured and structured data assets utilizing methodologies from machine learning,…",http://www.indeed.com/company/Quaxigma/jobs/Data-Scientist-3021c635a4ac77c5?fccid=a842adfd131aafdf&vjs=3,3021c635a4ac77c5,NA,internship
Administrative support for Artificial intelligence products...,Intel,4.1,30+ days ago,Illinois,NA,Demonstrated experience in customer service and project management in a dynamic and intensive environment.Typical duties may include but are not limited to the…,http://www.indeed.com/rc/clk?jk=ccebaf6123d8f393&fccid=f1374be6a45f4b8a&vjs=3,ccebaf6123d8f393,NA,internship
"Research Intern, Applied Research - Computer Vision",Facebook,4.2,30+ days ago,"New York, NY 10017 (Midtown area)",NA,"Research and/or work experience in machine learning, deep learning, and/or computer vision.Develop novel state-of-the-art vision algorithms and corresponding…",http://www.indeed.com/rc/clk?jk=e0c1db59ef359933&fccid=1639254ea84748b5&vjs=3,e0c1db59ef359933,NA,internship
INTERN - Merchandising Services - Data Science Summer Intern...,The Home Depot,3.8,30+ days ago,"Atlanta, GA",NA,"Python, R, SQL, Tableau, SAS, CPLEX.Develop and implement project plans;Analytics, Statistics, Economics, Business, Finance, Mathematics, Industrial or…",http://www.indeed.com/rc/clk?jk=b4f9c6f69b95b4d3&fccid=82e58e9861d48566&vjs=3,b4f9c6f69b95b4d3,NA,internship
Software Engineer Intern- Spacial AI (PhD),Facebook,4.2,30+ days ago,"Seattle, WA 98101 (Downtown area)",NA,"The Spatial AI Vision team applies a range of software, computer vision and machine learning techniques to build products that enable new ways for people to…",http://www.indeed.com/rc/clk?jk=fe5175f6970979f0&fccid=1639254ea84748b5&vjs=3,fe5175f6970979f0,NA,internship
Data Science Intern,"Amazon.com Services, Inc.",3.6,30+ days ago,"Seattle, WA",NA,"We are looking for motivated Data Scientists with excellent leadership skills, and the ability to develop, automate, and run analytical models of our systems.",http://www.indeed.com/rc/clk?jk=57a7a236fda832a8&fccid=fe2d21eef233e94a&vjs=3,57a7a236fda832a8,NA,internship
"Applied Science Intern, Machine Learning","Amazon.com Services, Inc.",3.6,30+ days ago,"Seattle, WA",NA,"Amazon has multiple positions available for Machine Learning Scientists in Seattle, Palo Alto, Boston, New York, Pittsburgh, and Cupertino.",http://www.indeed.com/rc/clk?jk=cca913dfe9d15eed&fccid=fe2d21eef233e94a&vjs=3,cca913dfe9d15eed,NA,internship
"Research Scientist, Deep Learning Intern (Fall 2019)",Clarifai,NA,30+ days ago,"San Francisco, CA",NA,"Do machine learning research and publish papers after rigorous evaluation.As an intern on the Research Scientist, Deep Learning Team, you will work closely…",http://www.indeed.com/rc/clk?jk=e08d4f5e748236e0&fccid=0bfd6b75d98e7714&vjs=3,e08d4f5e748236e0,NA,internship
"Applied Science Intern, Computer Vision & Robotics","Amazon.com Services, Inc.",3.6,30+ days ago,"Seattle, WA",NA,"Degree in Engineering, Computer Science, Machine Learning, Math, Statistics or related fields with specialization in Computer Vision, Image recognition,…",http://www.indeed.com/rc/clk?jk=ed78f18048b11024&fccid=fe2d21eef233e94a&vjs=3,ed78f18048b11024,NA,internship
Artificial Intelligence Intern,RMSF Corporation,NA,30+ days ago,"Kansas City, MO 64131 (Legacy East area)",NA,The role of the intern is to conduct technical research on different machine learning algorithms.Research and develop machine learning algorithms for pattern…,http://www.indeed.com/rc/clk?jk=2904df09c3744962&fccid=793b1705d1e3b387&vjs=3,2904df09c3744962,NA,internship
FY20 Intern Conversion: Data Scientist,Walmart,3.5,30+ days ago,"San Bruno, CA 94066",NA,"Data Scientists are responsible for researching new trends in the industry and utilizing up-to-date technology (for example, HBase, MapReduce, LAPack, Gurobi)…",http://www.indeed.com/rc/clk?jk=e2a8b9dcd774d6f2&fccid=822bc5d9a49270ea&vjs=3,e2a8b9dcd774d6f2,NA,internship
2020 Intern - Data Scientist,IBM,3.9,30+ days ago,United States,NA,"Business acumen is an important skill for data scientists to effectively communicate their findings to business leaders, data scientists need strong consulting,…",http://www.indeed.com/rc/clk?jk=1de6a9e3c3eb1a37&fccid=de71a49b535e21cb&vjs=3,1de6a9e3c3eb1a37,NA,internship
FY20 Intern Conversion: Data Scientist,Walmart eCommerce,3.5,30+ days ago,"San Bruno, CA 94066",NA,"Data Scientists are responsible for researching new trends in the industry and utilizing up-to-date technology (for example, HBase, MapReduce, LAPack, Gurobi)…",http://www.indeed.com/rc/clk?jk=69c642ee74345682&fccid=8c49e99f20f89e48&vjs=3,69c642ee74345682,NA,internship
2020 Intern - Senior Data Scientist,IBM,3.9,30+ days ago,United States,NA,"Business acumen is an important skill for data scientists to effectively communicate their findings to business leaders, data scientists need strong consulting,…",http://www.indeed.com/rc/clk?jk=f8da4a8df0df73dc&fccid=de71a49b535e21cb&vjs=3,f8da4a8df0df73dc,NA,internship
Computer Vision and Machine Learning in Traffic Scenes,Honda Research Institute USA,NA,30+ days ago,"San Jose, CA",NA,The title includes multiple positions which focus on developing computer vision and machine learning algorithms to capture the detailed semantics of 2D and/or…,http://www.indeed.com/rc/clk?jk=817c088ed501471c&fccid=0aad0b277b718ea4&vjs=3,817c088ed501471c,NA,internship
Internship Opportunities for PhD Students: Natural Language...,Microsoft,4.2,30+ days ago,"Redmond, WA",NA,"If you need assistance and/or a reasonable accommodation due to a disability during the application or the recruiting process, please send a request via the…",http://www.indeed.com/rc/clk?jk=a1f9bbbe8f2d69c3&fccid=734cb5a01ee60f80&vjs=3,a1f9bbbe8f2d69c3,NA,internship
"Data Scientist, Analytics, Intern",Facebook,4.2,30+ days ago,"New York, NY 10017 (Midtown area)",NA,Work closely with a Product Manager and Engineering team to proactively create rule and manage decisions.Candidates will help own analytics for a particular…,http://www.indeed.com/rc/clk?jk=1eb7e96ae99c871d&fccid=1639254ea84748b5&vjs=3,1eb7e96ae99c871d,NA,internship
Data Scientist Intern,SpotX,4.1,30+ days ago,"Salt Lake City, UT",NA,Data Scientists build machine learning and statistical models to discover actionable insights.Research and experiment with different machine learning…,http://www.indeed.com/rc/clk?jk=801fb8bebd9b1763&fccid=3d49bf42f1ae665d&vjs=3,801fb8bebd9b1763,NA,internship
Data Scientist (Intern) - United States,Cisco Careers,4.1,30+ days ago,"San Jose, CA",NA,"Work on massive structured, unstructured, transactional and real-time data sets from a variety of sources to analyze customer usage patterns and provide…",http://www.indeed.com/rc/clk?jk=93852554b89e8d9c&fccid=dfc44f3b8c44a6db&vjs=3,93852554b89e8d9c,NA,internship
Internship Opportunities for Students: Data & Applied Scienc...,Microsoft,4.2,30+ days ago,"Redmond, WA",NA,We are looking for highly motivated and passionate Data Scientists to apply rigorous scientific methodology and algorithms to data in order to improve Microsoft…,http://www.indeed.com/rc/clk?jk=7688bf23a4e8e7c6&fccid=734cb5a01ee60f80&vjs=3,7688bf23a4e8e7c6,NA,internship
Internship Opportunities for PhD Students: Data & Applied Sc...,Microsoft,4.2,30+ days ago,"Redmond, WA",NA,We are looking for highly motivated and passionate Data Scientists to apply rigorous scientific methodology and algorithms to data in order to improve Microsoft…,http://www.indeed.com/rc/clk?jk=f85ad23d857625d4&fccid=734cb5a01ee60f80&vjs=3,f85ad23d857625d4,NA,internship
Internship Opportunities for PhD Students: Machine Learning,Microsoft,4.2,30+ days ago,"Redmond, WA",NA,"Familiarity or ability to quickly ramp up with machine learning, deep learning, data mining, and/or data science.Experience in Object Oriented programming.",http://www.indeed.com/rc/clk?jk=7e80b1179497d189&fccid=734cb5a01ee60f80&vjs=3,7e80b1179497d189,NA,internship
Internship Opportunities for PhD Students: Computer Vision,Microsoft,4.2,30+ days ago,"Redmond, WA",NA,"If you need assistance and/or a reasonable accommodation due to a disability during the application or the recruiting process, please send a request via the…",http://www.indeed.com/rc/clk?jk=a38ac227dbcbb1f7&fccid=734cb5a01ee60f80&vjs=3,a38ac227dbcbb1f7,NA,internship
Data Science Intern,RS Energy Group,NA,30+ days ago,"Conshohocken, PA",NA,"RS Energy Group (RSEG) provides industry-leading technology, advanced analytics and applied data science to support and strengthen companies that operate or…",http://www.indeed.com/rc/clk?jk=a9b31e3557bdf5fc&fccid=b5f5a475a9aae6da&vjs=3,a9b31e3557bdf5fc,NA,internship
Full-Stack / AI Software Engineer – Internship,COI Energy Services,NA,30+ days ago,"Tampa, FL",$15 - $25 an hour,"Strong familiarity with all relevant AWS microservices dealing with data organization, parsing, flow, storage, machine learning, and artificial intelligence.",http://www.indeed.com/rc/clk?jk=6bb03e1275c6e0d9&fccid=63c21550b1641bf2&vjs=3,6bb03e1275c6e0d9,NA,internship
Machine Learning / AI - Engineering & Research Internship,Apple,4.2,30+ days ago,"Santa Clara Valley, CA 95014",NA,"The team pursues research & development in the areas of machine learning (ML) with particular focus on deep learning (DL), computer vision (CV), natural…",http://www.indeed.com/rc/clk?jk=2cc051678a03e1b7&fccid=c1099851e9794854&vjs=3,2cc051678a03e1b7,NA,internship
Intern (Artificial Intelligence),"Orbis, Inc.",3.2,30+ days ago,"Charleston, SC",NA,"Specifically, ORBIS is looking to develop Artificial Intelligence and Machine Learning applications and products to deploy in commercial and Federal Government…",http://www.indeed.com/rc/clk?jk=90f2a62ed59b51ee&fccid=61999ed7c83327a5&vjs=3,90f2a62ed59b51ee,NA,internship
Intern Data Scientist,"ExtraHop Networks, Inc.",3.8,30+ days ago,"Seattle, WA 98101 (Downtown area)",NA,"Solid knowledge of Linux toolchain, Python, JavaScript, and shell scripting.Experience using Linux networking tools such as tcpdump, tcpreplay, pcap tools,…",http://www.indeed.com/rc/clk?jk=b0f8b1ea788df7eb&fccid=5dd0073fb1381f82&vjs=3,b0f8b1ea788df7eb,NA,internship
AI/Machine Learning/Coding Enthusiast,Liquid Carrot,NA,30+ days ago,"Miami, FL",NA,Anyone who is hungry to positively impact society using Artificial Intelligence (AI) & Machine Learning (ML).Some experience in Machine Learning.,http://www.indeed.com/rc/clk?jk=8abd0f14d7451de1&fccid=a094826369ae9ba0&vjs=3,8abd0f14d7451de1,NA,internship
Data Scientist Internship,A³ by Airbus,NA,30+ days ago,"Sunnyvale, CA",NA,Potential development of machine learning algorithms with time series and dynamic analysis to improve demand forecast and optimize localization and shipment of…,http://www.indeed.com/rc/clk?jk=8414970d7bc4e4b0&fccid=17421b1fb60b9c91&vjs=3,8414970d7bc4e4b0,NA,internship
"Software Engineering, Computer Vision Intern - Summer 2020",Seegrid,NA,30+ days ago,"Pittsburgh, PA 15275",NA,"Explore approaches to complex technical problems in machine perception.Enrolled in a Master's, or PhD program in Computer Science, Computer Vision/Image…",http://www.indeed.com/rc/clk?jk=1fbe724604135e29&fccid=04c79dad370e84b6&vjs=3,1fbe724604135e29,NA,internship
"Internship - Statistical Programming Intern (Summer Session,...",Acumen,4.1,NA,"San Francisco, CA",NA,"Use statistical programming languages, such as SAS, STATA, and R, to perform econometric and statistical analyses of health care policy.",http://www.indeed.com/pagead/clk?mo=r&ad=-6NYlbfkN0AbcLYJH6EEU2hhfUhIe4V-wtZUPXOEfJh72XLwlGjJwXW5GoFa_FpEQM93zpncoe7FKpRbOR5qlczYfSsy0Rgg_4DDOB-CCZJHQF_6wd5QOlZ1BsDMVWOLocSHYMkQzEo2HOPmObjjLqQY4Zn9242Hj8w-52A_w1Ew1vW_61zm4kB8ewacFvdKP6KZhBM1lP3A8w03p9hLk3I5vg1P5SUXOlynvu3hPF29NxMm0AaCxbQqbYTVkpBSNdVwfnQLGcSXLj6kSv_FjvSzJuCznoHAQxvFKYPw1Ua6Dtx2iuqKQh-VRyYBWRcXt524PCvs88hGv7bG9vnZKqi19W3Y7lnWMAExxWsM6DIwK-m-jaJui7gZfovyNqULVTVWLOmR6XLIV7pQJk-YuLhdDtISvx1M&p=50&fvj=0&vjs=3,9104224716d615fd,4972874631828035,internship
"Internship - Statistical Programming Intern (Summer Session,...",Acumen,4.1,NA,"Washington, DC 20022",NA,"Use statistical programming languages, such as SAS, STATA, and R, to perform econometric and statistical analyses of health care policy.",http://www.indeed.com/pagead/clk?mo=r&ad=-6NYlbfkN0AbcLYJH6EEU2hhfUhIe4V-wtZUPXOEfJh72XLwlGjJwXW5GoFa_FpEOIdqgnFoZ6Gv6aoJV1Wzogwf7CaudjDL9hR-3qF0ODHgidAaYmtShhyL3ObhwY7AzOnxiXzLo7VQlOXxKqkh0acaGK9rF_0JPDZla3TZKsWRMDWMFB8PIy7QkeqpP6wdxxMuWXAJJAXF8kbdVsNEZtIxZ0wfaAombFg4TJ0lUkjSBkqGQKJtxKOwZzcUIUOywg992gSivVq5O1u7xRqWRJvTsDRrmkgKIGjzlwMzEXhRfMeHlcefH0acqmR96D_sFht9wcoBF0j-SxAlnZ3zRnnWfO7gMFsxdKTFCjsxcPlP0morOm9ciW8MdaAqUYBWA9xsKBgjtP65hzl4hQDH7M0RTyaBiH61rq9KXPCcNfE=&p=51&fvj=0&vjs=3,ff0ff2ddf15c9c99,4972874631828035,internship
Software Engineer-Data Science PHD (Intern)-United States Du...,Cisco Systems,4.1,NA,"Austin, TX 78716",NA,Please use the link below for details about the position.,http://www.indeed.com/pagead/clk?mo=r&ad=-6NYlbfkN0B2LP6KtwgLMWcIJbzQK4y118hUYa2NHT0ELzb4aR6nDrO9_32R0Ltax0s-kX1YxTT0kF8p-mDS5rtvXNnDxKbDqSBVbhoX8Y4uunwRMSAQLxB7HbJSbqfuDb1Z_DXe-R_5XSRh4oA3xLkgMcTMxrs8Jr0YG2oGtAod-Ae1CK1mcrDT1i6Jzhew5iVLbzW3fOsZi170B6vd8uKR0S2jf7Rz2EjU_vVQ6BGRCAHQjKpEJy5hB452b4B6HBepow-ZGkBjkIlFnwVcycipgGsVG2xXbvgN1dG3fZsJRsYQYVMKDbsVEyGLBaa1ZIgTiy4LRbhROMWfxACi9IBMDLbMMJIt8MFOf9cokd9i1IQvRKChnkPeCHGZuQqNJKXRqxcfFPAte55rO18hCxaOhBWuUCSn&p=52&fvj=0&vjs=3,33dc6dcffdd60c04,3565145538192372,internship
