title,company,empn_rate,posted_time,location,salary,preview,link,job_key,empn_id,job_type
Marketing Data Science Intern - Summer 2020,Sonic Drive-In,3.5,30+ days ago,"Oklahoma City, OK 73104",NA,"Statistical software knowledge (SQL, R, Python, Scala, etc.).Intern will work with Insights Team to analyze:Develop business process that work across multiple…",http://www.indeed.com/rc/clk?jk=d4269094c663e71b&fccid=35a91adc30d9ede0&vjs=3,d4269094c663e71b,NA,internship
Machine Learning Intern,Centauri,4.5,30+ days ago,"Chantilly, VA",NA,Use creative and technical skills to implement cutting edge machine learning algorithms in Python or other object-oriented languages as appropriate.,http://www.indeed.com/rc/clk?jk=c46e95aa690e0e6c&fccid=2540607df11515db&vjs=3,c46e95aa690e0e6c,NA,internship
Machine Learning Intern,Novetta,3.4,30+ days ago,"McLean, VA",NA,"Gain hands-on experience with cloud technology and machine learning and deep learning libraries and platforms.Cyber, Entity, and Multi-Int Analytics.",http://www.indeed.com/rc/clk?jk=8b7abe2e478dd279&fccid=1d69e9a5b2cfbeca&vjs=3,8b7abe2e478dd279,NA,internship
Data Science Intern,NICE inContact,2.9,30+ days ago,"Salt Lake City, UT",NA,"As our Data Science intern, you’ll wrangle data to support research and development projects as part of NICE inContact's analytics platform.",http://www.indeed.com/rc/clk?jk=5c053b7debcd942d&fccid=c87437465dde35f9&vjs=3,5c053b7debcd942d,NA,internship
Research Intern - Machine Learning,Microsoft,4.2,30+ days ago,"Cambridge, MA 02142 (East Cambridge area)",NA,Must have at least 1 machine learning paper submitted or published (e.g.If you need assistance and/or a reasonable accommodation due to a disability during the…,http://www.indeed.com/rc/clk?jk=8005f3699bc4f713&fccid=734cb5a01ee60f80&vjs=3,8005f3699bc4f713,NA,internship
Data Engineer Internship,Wellmark,4.0,30+ days ago,"Des Moines, IA",NA,"Previous exposure to machine learning or Artificial Intelligence (or this as the bullet “Knowledge of, or exposure, to analytical methods like machine learning …",http://www.indeed.com/rc/clk?jk=babef46def9752ac&fccid=add7a13d6c55ff59&vjs=3,babef46def9752ac,NA,internship
Statistical Analyst Intern - Summer 2020,Major League Lacrosse,5.0,30+ days ago,"Boston, MA",NA,"Preference will be given to those working towards a degree in Analytics, Economics, Sports Management, or Mathematics.Positions are available for Summer 2020.",http://www.indeed.com/rc/clk?jk=ed37626bd25a2a52&fccid=e90bed19f35e65cb&vjs=3,ed37626bd25a2a52,NA,internship
"Security Engineer Intern, Data Science (Online Safety)",Facebook,4.2,30+ days ago,"Menlo Park, CA",NA,Experience building systems based on machine learning and/or deep learning methods.We’re looking for a Data Science intern to help us get a deep understanding…,http://www.indeed.com/rc/clk?jk=0bc29b6d70ee7e60&fccid=1639254ea84748b5&vjs=3,0bc29b6d70ee7e60,NA,internship
Human Computer Interaction + Machine Learning Intern (Pittsb...,Apple,4.2,30+ days ago,"Seattle, WA",NA,"Relevant prior experience in industry, coursework, and/or academic research labs in at least one area of HCI, Machine Learning, Visualization, Accessibility,…",http://www.indeed.com/rc/clk?jk=78f3035cc652393f&fccid=c1099851e9794854&vjs=3,78f3035cc652393f,NA,internship
Computer Vision Intern,Matroid,NA,30+ days ago,"Palo Alto, CA 94306",NA,Explore new model families and machine learning algorithms.Experience with Deep Learning and CNNs.Help us solve automated intelligence.,http://www.indeed.com/rc/clk?jk=e48fd1b2b39aaa18&fccid=f6bdb031595414c5&vjs=3,e48fd1b2b39aaa18,NA,internship
"Intern, SWE, Machine Learning/Deep Learning, Behavior Predic...",Waymo,3.0,30+ days ago,"Mountain View, CA",NA,"Experience in machine learning or robotics.A strong publication record in top machine learning conferences such as NeurIPS, UAI and ICML.",http://www.indeed.com/rc/clk?jk=04bc93813b89827c&fccid=73ceef0a2153d2b8&vjs=3,04bc93813b89827c,NA,internship
"Internship - Statistical Programming Intern (Summer Session,...",Acumen LLC,3.5,30+ days ago,"Washington, DC",NA,"Use statistical programming languages, such as SAS, STATA, and R, to perform econometric and statistical analyses of health care policy.",http://www.indeed.com/rc/clk?jk=08bb3c17fdeb8691&fccid=d7c744248a9e6859&vjs=3,08bb3c17fdeb8691,NA,internship
"Research Intern, Machine Learning (PhD)",Facebook,4.2,30+ days ago,"Redmond, WA",NA,"Currently has or is in the process of obtaining a PhD in machine learning, computer vision, speech processing, applied statistics, computational neuroscience,…",http://www.indeed.com/rc/clk?jk=337d57fac6400cd2&fccid=1639254ea84748b5&vjs=3,337d57fac6400cd2,NA,internship
"Research Intern, Deep Learning and Image Synthesis (PhD)",Facebook,4.2,30+ days ago,"Redmond, WA",NA,"In particular we welcome PhD students in computer science, applied math, electrical engineering, or similar, with a strong background in deep learning,…",http://www.indeed.com/rc/clk?jk=0a2852232bf34076&fccid=1639254ea84748b5&vjs=3,0a2852232bf34076,NA,internship
"Internship - Statistical Programming Intern (Summer Session,...",Acumen LLC,3.5,30+ days ago,"Burlingame, CA 94010",NA,"Use statistical programming languages, such as SAS, STATA, and R, to perform econometric and statistical analyses of health care policy.",http://www.indeed.com/rc/clk?jk=2268ec16d4774e3b&fccid=d7c744248a9e6859&vjs=3,2268ec16d4774e3b,NA,internship
Data Scientist Internship,"Red Hat, Inc.",4.0,30+ days ago,"Raleigh, NC 27606 (West area)",NA,"Develop machine learning (ML), data mining, and statistical techniques and algorithms to create new scalable solutions for business problems by analysis of…",http://www.indeed.com/rc/clk?jk=10dad514b293fdc0&fccid=e24a60f01d1882d1&vjs=3,10dad514b293fdc0,NA,internship
"Data Scientist, Auction & Delivery Intern",Facebook,4.2,30+ days ago,"Menlo Park, CA",NA,Research applied machine learning questions in our ads system to improve advertiser value.Experience with machine learning in a production setting.,http://www.indeed.com/rc/clk?jk=4045377a3f699390&fccid=1639254ea84748b5&vjs=3,4045377a3f699390,NA,internship
AI Deep learning/Big data Engineer Internship,Gosvea,NA,30+ days ago,"San Jose, CA","$20,000 - $80,000 a year","Responsible for learning new technology of big data, practical project development, application technology research and providing IT services for customers.",http://www.indeed.com/company/Gosvea/jobs/Ai-Deep-Learning-Big-Data-Engineer-Internship-042ff2578f30d7fa?fccid=37dd93867d8858cd&vjs=3,042ff2578f30d7fa,NA,internship
"Internship - Data Scientist, Denver CO (Summer 2020)",Transamerica,3.6,30+ days ago,"Denver, CO 80221",NA,Design experiments and formulate machine learning problems to address major business challenges and innovation opportunities.,http://www.indeed.com/rc/clk?jk=8ba1188a82b6d9fa&fccid=6d2f19785dd4c73c&vjs=3,8ba1188a82b6d9fa,NA,internship
Central Maryland Summer Games 2020 Data Scientist Intern,Booz Allen Hamilton,3.9,30+ days ago,"Annapolis Junction, MD",NA,"Python, R, Matlab, Machine Learning algorithms, Splunk.Serve in an internship program geared towards students who have diverse backgrounds and are equipped to…",http://www.indeed.com/rc/clk?jk=c76a32282c755cd7&fccid=4e041af1d0af1bc8&vjs=3,c76a32282c755cd7,NA,internship
"Internship - Data Scientist, Denver CO (Summer 2020)",Aegon,3.9,30+ days ago,"Denver, CO",NA,Design experiments and formulate machine learning problems to address major business challenges and innovation opportunities.,http://www.indeed.com/rc/clk?jk=6a450dd5e68fe8de&fccid=817dbf75ac000d11&vjs=3,6a450dd5e68fe8de,NA,internship
Summer 2020 Internship Program - Data Science,DSW,3.6,30+ days ago,"Columbus, OH 43219 (Northeast area)",NA,"Self-starter who is passionate about data science and machine learning.The Data Science Intern, MP&A Advanced Analytics will work within a team that provides…",http://www.indeed.com/rc/clk?jk=0383a5e498840383&fccid=1cb78e87dd1f053e&vjs=3,0383a5e498840383,NA,internship
Data Science Internship,"Red Hat, Inc.",4.0,30+ days ago,"Raleigh, NC 27606 (West area)",NA,"As a Data Science Intern, you will focus on highlighting ways to apply Red Hat’s offerings in artificial intelligence (AI), machine learning (ML), and data…",http://www.indeed.com/rc/clk?jk=430a6c3b0792f779&fccid=e24a60f01d1882d1&vjs=3,430a6c3b0792f779,NA,internship
Data Science Intern,FiscalNote,3.3,30+ days ago,"Washington, DC 20004 (Downtown area)",NA,"At the core of our advanced analytics are our research scientists - designing, implementing, and deploying innovative solutions to a wide range of problems,…",http://www.indeed.com/rc/clk?jk=ce6f32821ae8ee26&fccid=d55ba0bc1050147f&vjs=3,ce6f32821ae8ee26,NA,internship
"Research Intern, Artificial Intelligence",Facebook,4.2,30+ days ago,"New York, NY 10017 (Midtown area)",NA,"We are seeking individuals passionate in areas such as deep learning, computer vision, audio and speech processing, natural language processing, machine…",http://www.indeed.com/rc/clk?jk=2982875778401ef4&fccid=1639254ea84748b5&vjs=3,2982875778401ef4,NA,internship
Machine Learning Intern (BS/MS),Electronic Arts,3.9,30+ days ago,"Austin, TX 78758 (North Austin area)",NA,Suggest and evaluate different algorithmic approaches to solve various machine learning and prediction use cases.Curious and passionate about learning.,http://www.indeed.com/rc/clk?jk=fb57d12b2247c36a&fccid=617d7f961cfcf54a&vjs=3,fb57d12b2247c36a,NA,internship
Data Science Research–Artificial Intelligence Intern,Hewlett Packard Enterprise,3.7,30+ days ago,"San Jose, CA 95191 (Rose Garden area)",NA,"Applied experience with machine learning on large datasets.R, Python, Java, C, C++, C#, VBA, SQL.We are looking for individuals passionate in areas such as…",http://www.indeed.com/rc/clk?jk=ceff56dc8b679559&fccid=216eb700022de6f6&vjs=3,ceff56dc8b679559,NA,internship
Software Engineer-Data Science PHD (Intern)-United States Du...,Cisco Systems,4.1,NA,"Austin, TX 78716",NA,Please use the link below for details about the position.,http://www.indeed.com/pagead/clk?mo=r&ad=-6NYlbfkN0B2LP6KtwgLMWcIJbzQK4y118hUYa2NHT0ELzb4aR6nDrO9_32R0Ltax0s-kX1YxTT0kF8p-mDS5rtvXNnDxKbDqSBVbhoX8Y4uunwRMSAQLxB7HbJSbqfuDb1Z_DXe-R_5XSRh4oA3xLkgMcTMxrs8UnXeS20tGO22OvI7V8XTeDJhnkC8LfYFHiEHBYsH9kZiEhw4rcyvLMHqTJMsWSrsXCQzDBskDX3Dyk52gsP2oB-TQZTtddC_EwvTBM0Ai89tqPnr4YJqOwiyPoW7-wcWeYESgNLe65wzehJKGbeQUk5KNwTgN4xAicpbdJ0ffZo6lmDpq2OxKiK-0mkTtA-kdlKf3h35ZSYmG0l4bddvsxu6N8avDBUS8lFdd4Uj7D-cbZ3fRQAJYnj5DMM9r4ZH&p=50&fvj=0&vjs=3,33dc6dcffdd60c04,3565145538192372,internship
Data Science Intern,NICE inContact,2.9,NA,"Salt Lake City, UT",NA,"As our Data Science intern, you’ll wrangle data to support research and development projects as part of NICE inContact's analytics platform.",http://www.indeed.com/pagead/clk?mo=r&ad=-6NYlbfkN0AbcLYJH6EEU2hhfUhIe4V-wtZUPXOEfJh72XLwlGjJwXW5GoFa_FpEOIdqgnFoZ6EWdvbiYbsFcwWFxce6fWxlzLEHo-JARm1WRB2Z90osqTGb4RUPTiCtQe5s7hivKpUGeJ5H0zNXsIRdnBdP0eCJpJvobNfOkQ9LjRfTYtCtBn1a2Um4xrXmA11Mr9QjAMUfUG4h-l8gQL4muUTlrIoNbQ_ifQzsbcVDT4H7jY1-k2D0Gn_VkaD7q4vDber8Vb22NxAnSr04KrDSFA_TLA4HD2wahBfSH1rFXse-Yc3ZHKwVt3QHEnjlizJoKUL5zXk7Aiya7Ivnt8rBDAZBShCKiQQg3rAZgQx22QmfYoY99c09PxjKN1KJuyv8H4kl25yqKHiucVNwh82D_swEN5xm&p=51&fvj=0&vjs=3,c17e8fbf78f3de5e,4972874631828035,internship
"Internship - Statistical Programming Intern (Summer Session,...",Acumen,4.1,NA,"Washington, DC 20022",NA,"Use statistical programming languages, such as SAS, STATA, and R, to perform econometric and statistical analyses of health care policy.",http://www.indeed.com/pagead/clk?mo=r&ad=-6NYlbfkN0AbcLYJH6EEU2hhfUhIe4V-wtZUPXOEfJh72XLwlGjJwXW5GoFa_FpEOIdqgnFoZ6Gv6aoJV1Wzogwf7CaudjDL9hR-3qF0ODHgidAaYmtShhyL3ObhwY7AzOnxiXzLo7VQlOXxKqkh0acaGK9rF_0J-uua2jAsfpK5zNove4M6c7pkR0VfmpODpGugIa1a7WS4iBZQ5jClIjC1U6O-oGWqaMsG4ADT230L7Emj8bsQWrHXhtaDhuS5FInHRrhDVDrSjPMTXcONumMhMoUm32o2mVUcb0aJlUP-2A6G-u9SCyz5Z2V5H_RJ_dQNraHwNCUe1zGDfKH-TmEK_2k8axem1jJJXLoL7V1oJog6TDrT118ryHUtIsC495_VJwdICZlvxA5yw57gmDWLXL4RUOFHlOgpwfJnZ7A=&p=52&fvj=0&vjs=3,ff0ff2ddf15c9c99,4972874631828035,internship
"Research Internship - Summer 2020 (NLP, Computer Vision, or...",Dataminr,4.2,NA,"New York, NY 10261",NA,"NLP, HCI, Machine Learning/Deep Learning, Computer Vision, Complex Networks.Work closely with a diverse, interdisciplinary team on a specific project to be…",http://www.indeed.com/pagead/clk?mo=r&ad=-6NYlbfkN0AbcLYJH6EEU2hhfUhIe4V-wtZUPXOEfJh72XLwlGjJwXW5GoFa_FpE4gNaYmusqPNvKBEbN5RNuq5OCWZZ8aBrnBvtzcpPvzsy3hlO5gtfVFMobqut4MPAs8bvYseHjcbQHkUCR6qosg7srDH5sbaa6xf7RxNZJvk1JiZGdpgz87DJilISOQUZQKIOF8br1Jua33rbhaJh7ZUJYJyyWexCOc3_C2GvObN7JXekATUi4-sHwVscXiP_HqAPG6Df023EBKt2-Hu0qGmve--nsxEEIKPYuC1Zvv15yl9eM5DZp3YPbDIeW5PJAp63UndxVFbcnmgBu52TCINxY8H8jXLLIv-B4LzSvGyInv7V0e4ry6LEeuazK6Adz2bdVY_xO5QqGz_3fx-ZnZ31qIen4aOQ&p=53&fvj=0&vjs=3,fc6baf43997bd119,4972874631828035,internship
Software Engineer-Data Science PHD (Intern)-United States Du...,Cisco Systems,4.1,30+ days ago,"Austin, TX 78716",NA,Please use the link below for details about the position.,http://www.indeed.com/pagead/clk?mo=r&ad=-6NYlbfkN0B2LP6KtwgLMWcIJbzQK4y118hUYa2NHT0ELzb4aR6nDrO9_32R0Ltax0s-kX1YxTT0kF8p-mDS5rtvXNnDxKbDqSBVbhoX8Y4uunwRMSAQLxB7HbJSbqfuDb1Z_DXe-R_5XSRh4oA3xLkgMcTMxrs87bDWK8y_fuaX_K8BS8JgTA41B1N2k6Pyum5GBNKPf6ZYWCjIhgMo1mTsacvlEAp-nXgoeUxdSpCvFc0zZM3M7xcWsZ0ufPfznS9LF1tM1uanhEBQnDNuVA2PBYHXQC84-IIWmqUpDoMRyUIsl1eK9k8DYqyt8JNjQ28lIKxgkeHYU7ZHF5jRZ_jcfGmZY1_hrfT_YdRqLQEBNhpLVL0RmpPtqMM3SdB2gBefDBS0n7sdZbErnkG8GbUueOKcZS8O&p=0&fvj=0&vjs=3,33dc6dcffdd60c04,3565145538192372,internship
Data Science Intern,NICE inContact,2.9,29 days ago,"Salt Lake City, UT",NA,"As our Data Science intern, you’ll wrangle data to support research and development projects as part of NICE inContact's analytics platform.",http://www.indeed.com/pagead/clk?mo=r&ad=-6NYlbfkN0AbcLYJH6EEU2hhfUhIe4V-wtZUPXOEfJh72XLwlGjJwXW5GoFa_FpEOIdqgnFoZ6EWdvbiYbsFcwWFxce6fWxlzLEHo-JARm1WRB2Z90osqTGb4RUPTiCtQe5s7hivKpUGeJ5H0zNXsIRdnBdP0eCJtkXNu381eks3PizEvZJvZWAeaOKnhCz71ymQPxbC8BzABriMnejnqGec_7SfoM44WU1jQN77AFxXCdYQr-v2aHHYv5NPoFbPQhcu06EH_26dSKk2fNBp-znXs1cXLHsrBeCVqin9shmPPdTy1e_M2ues6qdpvhJYrwjupT_ezlY_y8xabSfca4ZkvVAZ-fl0MSerwBbKWsiY9-TwkNqRMaHhCg9HLlDaR42XDebLBVltcV_u3vLdRmfD_UTZ4pub&p=1&fvj=0&vjs=3,c17e8fbf78f3de5e,4972874631828035,internship
"Intern, Machine Learning Infrastructure",Waymo,3.0,30+ days ago,"Mountain View, CA",NA,The Machine Learning Infrastructure team at Waymo builds the industrial scale machine learning platform used by practitioners developing software for our self…,http://www.indeed.com/rc/clk?jk=af3406555bf69899&fccid=73ceef0a2153d2b8&vjs=3,af3406555bf69899,NA,internship
Machine Learning Research Intern,Bosch Group,4.1,30+ days ago,"Pittsburgh, PA 15222 (Strip District area)",NA,"2+ years experience in Machine Learning, or Deep Learning.Original research, theoretical investigations, publications at top Machine Learning conferences and…",http://www.indeed.com/rc/clk?jk=01b2423ff230117d&fccid=a2faf1301ac6ad4b&vjs=3,01b2423ff230117d,NA,internship
Central Maryland Summer Games 2020 Data Scientist Intern,Booz Allen Hamilton,3.9,30+ days ago,"Annapolis Junction, MD",NA,"Python, R, Matlab, Machine Learning algorithms, Splunk.Serve in an internship program geared towards students who have diverse backgrounds and are equipped to…",http://www.indeed.com/rc/clk?jk=c76a32282c755cd7&fccid=4e041af1d0af1bc8&vjs=3,c76a32282c755cd7,NA,internship
2020 Summer Internship: Autonomous Mobility - Machine Learni...,Aptiv,4.1,30+ days ago,"Santa Monica, CA",NA,We are seeking a highly motivated Machine Learning Intern to help in achieving our goals.Bachelor’s degree or higher in Computer Science or relevant field.,http://www.indeed.com/rc/clk?jk=8672833173f5972d&fccid=8d390ab1843cb8bd&vjs=3,8672833173f5972d,NA,internship
2020 Summer Internship: Autonomous Mobility - Machine Learni...,Aptiv,4.1,30+ days ago,"Santa Monica, CA",NA,We are seeking a highly motivated Machine Learning Software Intern to help in achieving our goals.Bachelor’s degree or higher in Computer Science or relevant…,http://www.indeed.com/rc/clk?jk=db703cf5a75af9fc&fccid=8d390ab1843cb8bd&vjs=3,db703cf5a75af9fc,NA,internship
Machine Learning and AI Research Intern,Analog Devices,4.3,30+ days ago,"Boston, MA",NA,"This internship position is focused around the areas of machine learning, deep neural networks, computer vision, and algorithm development.",http://www.indeed.com/rc/clk?jk=214b39f3b7af4505&fccid=795688f508690d17&vjs=3,214b39f3b7af4505,NA,internship
R&D Artificial Intelligence Software Development Internship,HP,4.0,30+ days ago,"Spring, TX 77389",NA,"Design, develop, document, test, and debug software applications and systems that contain logical and mathematical solutions, especially in the areas of…",http://www.indeed.com/rc/clk?jk=c6451bc0ac9f7cf3&fccid=1b866506aec22461&vjs=3,c6451bc0ac9f7cf3,NA,internship
"BIOVIA Deep Learning, Imaging Focus, Internship May - August...",Dassault Systèmes,4.0,30+ days ago,"San Diego, CA 92121",NA,"As the Deep Learning intern, you will work on extending and validating deep learning functionality for applications in different fields including image analysis…",http://www.indeed.com/rc/clk?jk=a4c248f157f38278&fccid=29d37d43c382c8fe&vjs=3,a4c248f157f38278,NA,internship
Signals and Systems Research Intern,Analog Devices,4.3,30+ days ago,"Boston, MA",NA,"The Algorithmic Systems Group within Analog Garage creates advanced algorithms in the fields of signal processing, computer vision, machine learning, artificial…",http://www.indeed.com/rc/clk?jk=0b9d5ec61c272c77&fccid=795688f508690d17&vjs=3,0b9d5ec61c272c77,NA,internship
Circuits and Systems Research Intern,Analog Devices,4.3,30+ days ago,"Boston, MA",NA,Collaborating with other scientists and engineers developing machine learning and signal processing algorithms.Analyzing performance of hardware systems.,http://www.indeed.com/rc/clk?jk=da5fe60a665d3a3f&fccid=795688f508690d17&vjs=3,da5fe60a665d3a3f,NA,internship
Artificial Intelligence Research Engineering Intern,LOCKHEED MARTIN CORPORATION,4.1,30+ days ago,"Shelton, CT 06484",NA,Background in applying deep learning to real problems and knowledge of a major framework such as mxnet or PyTorch.And a background in sensor fusion.,http://www.indeed.com/rc/clk?jk=2961b5a7de6907a0&fccid=aeb15e43a6800b9d&vjs=3,2961b5a7de6907a0,NA,internship
Summer Internship: AI and Machine Learning in Education Rese...,"ACT, Inc.",3.8,30+ days ago,"Iowa City, IA",NA,Experience in machine learning for Natural Language Processing (NLP) with emphasis on deep learning based techniques.,http://www.indeed.com/rc/clk?jk=0e38330981d60c63&fccid=0893a94383349ac1&vjs=3,0e38330981d60c63,NA,internship
Computer Vision Software Development Interns,Kitware,NA,30+ days ago,"Clifton Park, NY",NA,"Knowledge or experience in computer vision and/or deep learning is a plus, but is not required.BS or MS students in related fields, including computer science,…",http://www.indeed.com/rc/clk?jk=2eafe85b1c6fc068&fccid=ffd98152d5e973b6&vjs=3,2eafe85b1c6fc068,NA,internship
"Research Intern, Deep Learning (PhD)",Facebook,4.2,30+ days ago,"Menlo Park, CA",NA,"Collaborate with other research scientists and software engineers to develop innovative deep learning techniques for vision, speech, user interface and other…",http://www.indeed.com/rc/clk?jk=b9cb665c734f4722&fccid=1639254ea84748b5&vjs=3,b9cb665c734f4722,NA,internship
Inventory Analyst 2020 Summer Intern,Advance Auto Parts,3.5,30+ days ago,"Raleigh, NC",NA,The Inventory Intern must be able to manage multiple projects simultaneously and prioritize in accordance of a rapidly changing environment.,http://www.indeed.com/rc/clk?jk=fbb1f17ac5adb872&fccid=024f492ec424f077&vjs=3,fbb1f17ac5adb872,NA,internship
2020 Data Scientist Intern,Lyft,3.5,30+ days ago,"San Francisco, CA",NA,"Experience analyzing data in R or Python;As a data science team, we work collaboratively with partners across product, engineering, operations and growth to…",http://www.indeed.com/rc/clk?jk=6bf61af96a5ca7d2&fccid=7dcf8477ac404a55&vjs=3,6bf61af96a5ca7d2,NA,internship
Data Science Graduate Internship,Nike,4.2,30+ days ago,"Beaverton, OR",NA,We'll drive marketplace health and mutual profitability by delivering insights to help our business partners manage supply and inventory investments and drive…,http://www.indeed.com/rc/clk?jk=0a1748836ea179c1&fccid=2c62e4de04b8f952&vjs=3,0a1748836ea179c1,NA,internship
Data Science Intern,Bosch Group,4.1,30+ days ago,"Sunnyvale, CA 94085",NA,Strong foundations in machine learning and data visualization.Visualization tools & techniques for large data sets.Proficient in programming in Python or R.,http://www.indeed.com/rc/clk?jk=fc072cf68d7574af&fccid=a2faf1301ac6ad4b&vjs=3,fc072cf68d7574af,NA,internship
"Data Scientist, Infrastructure Strategy Intern",Facebook,4.2,30+ days ago,"Seattle, WA 98101 (Downtown area)",NA,"Leverage tools like R, Python, Hadoop & SQL to drive efficient analytics.Build and maintain data driven optimization models, experiments, forecasting…",http://www.indeed.com/rc/clk?jk=b36c081e42dc6dfb&fccid=1639254ea84748b5&vjs=3,b36c081e42dc6dfb,NA,internship
"Data Scientist, Intern (2020)",Duolingo,NA,30+ days ago,"Pittsburgh, PA",NA,Join our team of data scientists and use our database of rich user data to generate insights to guide product development for 300 million learners worldwide.,http://www.indeed.com/rc/clk?jk=2f179bfc432cf72f&fccid=1d7146bd38091a7a&vjs=3,2f179bfc432cf72f,NA,internship
Data Science Intern (BS / MS) - Intern,ExxonMobil,4.0,30+ days ago,"Spring, TX",NA,"Use data visualization, statistical analysis, pattern recognition, and machine learning – along with domain knowledge and subject-specific models – to solve…",http://www.indeed.com/rc/clk?jk=d829db07597e130b&fccid=1ddb91d85c72e885&vjs=3,d829db07597e130b,NA,internship
Data Science Intern,Aretove,NA,30+ days ago,"New York, NY",NA,"Be a part of the data science team to produce high quality data analytics and insights.Experience in programming, data science and machine learning.",http://www.indeed.com/rc/clk?jk=188be042a58efa2c&fccid=758966cb05365905&vjs=3,188be042a58efa2c,NA,internship
Data Science / Ops Research / Statistics / Mathematics Inter...,Mitre Corporation,4.0,30+ days ago,"Bedford, MA 01730",NA,"Data Science / Ops Research / Statistics / Mathematics Intern - SUMMER 2020 - (00054287).Do not submit via the ""Apply for Job"" button above.",http://www.indeed.com/rc/clk?jk=6c41880024ba1491&fccid=fd03a1a845b02aae&vjs=3,6c41880024ba1491,NA,internship
Machine Learning Engineer - Intern,Zillow,3.8,30+ days ago,"Seattle, WA 98101 (Downtown area)",NA,"Zillow is hiring a Machine Learning Engineer - Intern for a 12 week summer internship, with an interest in web-scale distributed systems, data engineering, and…",http://www.indeed.com/rc/clk?jk=1b73769888ea60ff&fccid=913e1b259c8d65e2&vjs=3,1b73769888ea60ff,NA,internship
Software Engineering Intern - Data Science AI/ML,HP,4.0,30+ days ago,"Fort Collins, CO 80528",NA,"Ensure quality and performance assurance.To engineer experiences that amaze.As a Software Engineer Intern, you will work with a team with Personal Systems on…",http://www.indeed.com/rc/clk?jk=e3a2a36f78fc9b3c&fccid=1b866506aec22461&vjs=3,e3a2a36f78fc9b3c,NA,internship
Data Science Intern - Lab41,In-Q-Tel,3.5,30+ days ago,"Menlo Park, CA 94025",NA,"IQT Labs West brings industry, government, and academia together to tackle challenging problems in audio and speech, video and image processing, computer vision…",http://www.indeed.com/rc/clk?jk=a80f79780d496710&fccid=9c0f9278e73b7e22&vjs=3,a80f79780d496710,NA,internship
"Data Scientist, Intern (2020)",Duolingo University Programs,NA,30+ days ago,"Pittsburgh, PA",NA,Join our team of data scientists and use our database of rich user data to generate insights to guide product development for 300 million learners worldwide.,http://www.indeed.com/rc/clk?jk=9294410761447b6e&fccid=16e19e47fd1dbf70&vjs=3,9294410761447b6e,NA,internship
"Data Science Intern, Monetization",Unity Technologies,4.0,30+ days ago,"San Francisco, CA 94107 (South Of Market area)",NA,"Many of the services require automated decision making in the form of machine learning.As part of the Data Science team, you will work to define and optimize…",http://www.indeed.com/rc/clk?jk=140cf6e9ae690f84&fccid=880e4714f2ad94a8&vjs=3,140cf6e9ae690f84,NA,internship
Data Scientist (PhD) - Intern,ExxonMobil,4.0,30+ days ago,"Spring, TX",NA,"Use data visualization, statistical analysis, pattern recognition, and machine learning – along with domain knowledge and subject-specific models – to solve…",http://www.indeed.com/rc/clk?jk=fc4bef82f5ea2f9a&fccid=1ddb91d85c72e885&vjs=3,fc4bef82f5ea2f9a,NA,internship
Machine Learning Graphics Intern,Unity Technologies,4.0,30+ days ago,"San Francisco, CA 94107 (South Of Market area)",NA,You goal will be to select a project and dig deep into that area to see if it can be practically used for content creation.,http://www.indeed.com/rc/clk?jk=bd8be56049b81034&fccid=880e4714f2ad94a8&vjs=3,bd8be56049b81034,NA,internship
"Machine Learning Intern (ML-Agents), AI@Unity",Unity Technologies,4.0,30+ days ago,"San Francisco, CA 94107 (South Of Market area)",NA,Enabling Unity developers to train character behaviors using machine learning techniques such as deep reinforcement learning and imitation learning.,http://www.indeed.com/rc/clk?jk=1f7e7fe3c30067dd&fccid=880e4714f2ad94a8&vjs=3,1f7e7fe3c30067dd,NA,internship
2020 MBA/Master’s Level Internship – Data Scientist (Charlot...,U.S. Bank,3.6,30+ days ago,"Charlotte, NC",NA,"Research and build a detailed understanding of the data issues and related data assets in order to analyze data which may include coding in R, Python, SAS and…",http://www.indeed.com/rc/clk?jk=e5cb8302ff1e5c0e&fccid=ae5bfc395c530fbc&vjs=3,e5cb8302ff1e5c0e,NA,internship
